{
  "meta": {
    "schema_version": "1.0.0",
    "source_document": "/Users/martialmahougnonamoussou/Downloads/How to analyze a merchant statement.docx",
    "output_style": "Structured Checklist",
    "scope": "Explicit + Inferred",
    "granularity": "Universal rules only",
    "coverage": "Includes statement walkthrough content and Q&A operational rules",
    "extraction_method": {
      "pass_1": "Enumerated all candidate analysis points from the full transcript, including trivial checks and examples.",
      "pass_2": "Normalized processor examples into universal rules, preserved thresholds/formulas, and deduplicated overlapping logic with rationale."
    }
  },
  "elements": [
    {
      "id": "E001",
      "name": "Two-bucket cost model",
      "category": "core_economics_and_formulas",
      "description": "Merchant processing costs must be split into card-brand costs and processor costs before any optimization analysis.",
      "required_inputs": ["total_fees", "statement_fee_sections", "processor_fee_lines", "card_brand_fee_lines"],
      "rule_or_threshold": "Card-brand fees + processor fees = total cost model baseline",
      "calculation": null,
      "trigger_condition": "Always",
      "recommended_action": ["Separate fee lines into card-brand vs processor-owned buckets before benchmarking."],
      "source_type": "explicit",
      "source_trace": ["S02: 'there's really kind of two buckets where your fees come from'"]
    },
    {
      "id": "E002",
      "name": "Interchange table breadth awareness",
      "category": "core_economics_and_formulas",
      "description": "Analysis logic must account for many interchange outcomes rather than assuming a single flat wholesale card rate.",
      "required_inputs": ["card_type", "entry_mode", "brand", "interchange_rows"],
      "rule_or_threshold": "~400 interchange rates exist",
      "calculation": null,
      "trigger_condition": "Always",
      "recommended_action": ["Model interchange as multi-rate, not flat-rate."],
      "source_type": "explicit",
      "source_trace": ["S02: 'there are 400 different rates ... called interchange rates'"]
    },
    {
      "id": "E003",
      "name": "Card-brand fee share baseline",
      "category": "core_economics_and_formulas",
      "description": "Card-brand/interchange component usually represents most of total program cost.",
      "required_inputs": ["total_fees", "card_brand_fee_total"],
      "rule_or_threshold": "Card-brand share typically 60%-80%",
      "calculation": "card_brand_fee_share = card_brand_fee_total / total_fees",
      "trigger_condition": "Always",
      "recommended_action": ["Compare observed share against 60%-80% baseline to detect classification or markup anomalies."],
      "source_type": "explicit",
      "source_trace": ["S02: 'that's going to make between 60 and 80% of what you're paying'"]
    },
    {
      "id": "E004",
      "name": "Processor fee share baseline",
      "category": "core_economics_and_formulas",
      "description": "Processor-owned markup and ancillary fees are expected minority share but still optimization target.",
      "required_inputs": ["total_fees", "processor_fee_total"],
      "rule_or_threshold": "Processor share typically 20%-40%",
      "calculation": "processor_fee_share = processor_fee_total / total_fees",
      "trigger_condition": "Always",
      "recommended_action": ["Flag processor share materially above expected range for pricing review."],
      "source_type": "explicit",
      "source_trace": ["S02: 'payment processor fees ... 20 to 40% of your program'"]
    },
    {
      "id": "E005",
      "name": "No special wholesale myth check",
      "category": "core_economics_and_formulas",
      "description": "Do not accept claims of exclusive wholesale card-brand pricing from processors.",
      "required_inputs": ["sales_claims", "processor_proposal_notes"],
      "rule_or_threshold": "All processors pay same card-brand wholesale fees",
      "calculation": null,
      "trigger_condition": "When proposal claims unique wholesale access",
      "recommended_action": ["Validate comparisons based on processor markup and service terms, not wholesale claims."],
      "source_type": "explicit",
      "source_trace": ["S02: 'all credit card processor pay the exact same amount in those card brand fees'"]
    },
    {
      "id": "E006",
      "name": "Net effective rate as primary KPI",
      "category": "core_economics_and_formulas",
      "description": "Overall statement health should be measured first by net effective rate.",
      "required_inputs": ["total_fees", "total_sales"],
      "rule_or_threshold": "Net effective rate is the core decision KPI",
      "calculation": "net_effective_rate = total_fees / total_sales",
      "trigger_condition": "Always",
      "recommended_action": ["Display net effective rate in every analysis output."],
      "source_type": "explicit",
      "source_trace": ["S02: 'fees divided by your sales your net effective rate ... the one rate that matters'"]
    },
    {
      "id": "E007",
      "name": "Interchange drivers",
      "category": "core_economics_and_formulas",
      "description": "Interchange variation depends on where/how card is used and whether card is present.",
      "required_inputs": ["card_present_flag", "channel", "card_program_type"],
      "rule_or_threshold": null,
      "calculation": null,
      "trigger_condition": "Always",
      "recommended_action": ["Include card-present/card-not-present context in all fee variance explanations."],
      "source_type": "explicit",
      "source_trace": ["S02: 'depend on where you use the card ... was card present or card not present'"]
    },
    {
      "id": "E008",
      "name": "Representative month integrity check",
      "category": "statement_structure_and_reading_sequence",
      "description": "Savings analysis must use a representative month and avoid cherry-picked high-volume periods.",
      "required_inputs": ["monthly_sales_graph", "selected_analysis_month"],
      "rule_or_threshold": "Reject non-representative outlier month inputs",
      "calculation": null,
      "trigger_condition": "When single-month quote is used",
      "recommended_action": ["Validate month against trailing trend before quoting expected savings."],
      "source_type": "explicit",
      "source_trace": ["S03: 'make sure they're not taking a very busy month and overpromise savings'"]
    },
    {
      "id": "E009",
      "name": "Monthly stability check",
      "category": "statement_structure_and_reading_sequence",
      "description": "Use month-to-month trend stability to assess whether period is suitable for benchmark comparisons.",
      "required_inputs": ["monthly_sales_values"],
      "rule_or_threshold": null,
      "calculation": "stability = variance(monthly_sales_values)",
      "trigger_condition": "When comparing offers or rerates",
      "recommended_action": ["If unstable seasonality exists, run multi-month weighted analysis."],
      "source_type": "inferred",
      "source_trace": ["S03: statement graph used to confirm 'pretty equal value most months'"]
    },
    {
      "id": "E010",
      "name": "Statement sectioning baseline",
      "category": "statement_structure_and_reading_sequence",
      "description": "Analysis should parse statement into summary, interchange detail, processor markup, and add-on fees.",
      "required_inputs": ["statement_pages", "line_items"],
      "rule_or_threshold": null,
      "calculation": null,
      "trigger_condition": "Always",
      "recommended_action": ["Use deterministic section tags to map each fee line."],
      "source_type": "inferred",
      "source_trace": ["S03-S09 walkthrough repeatedly follows summary -> interchange -> markup -> ancillary fees"]
    },
    {
      "id": "E011",
      "name": "Interchange detail row capture",
      "category": "statement_structure_and_reading_sequence",
      "description": "For each interchange row capture transaction count, volume, rate, per-item fee, and total paid.",
      "required_inputs": ["interchange_rows"],
      "rule_or_threshold": null,
      "calculation": null,
      "trigger_condition": "When interchange detail exists",
      "recommended_action": ["Store row-level detail for audit and downgrade detection."],
      "source_type": "explicit",
      "source_trace": ["S04: 'number of transactions ... amount ... rate ... per item fee ... what you paid'"]
    },
    {
      "id": "E012",
      "name": "Basis-point notation normalization",
      "category": "statement_structure_and_reading_sequence",
      "description": "Statements may express basis points in different numeric formats; normalize before comparisons.",
      "required_inputs": ["rate_display_format", "raw_rate_value"],
      "rule_or_threshold": "Example mapping: 1.82% = 182 bps; 0.80% may appear as 0.008",
      "calculation": "bps = percent * 100",
      "trigger_condition": "When rate formats differ",
      "recommended_action": ["Normalize all rates to basis points and percent in output."],
      "source_type": "explicit",
      "source_trace": ["S04/S07: examples of 1.82, 1.38 and 0.008 display styles"]
    },
    {
      "id": "E013",
      "name": "Blended-line parsing",
      "category": "statement_structure_and_reading_sequence",
      "description": "Some processors combine interchange and markup in one line while still exposing underlying components.",
      "required_inputs": ["combined_fee_lines", "embedded_bottom_number", "embedded_top_number"],
      "rule_or_threshold": null,
      "calculation": null,
      "trigger_condition": "When statement bundles top and bottom values per card type",
      "recommended_action": ["Split blended rows into card-brand and processor components before analysis."],
      "source_type": "explicit",
      "source_trace": ["S06: 'top number is markup ... bottom number is interchange'"]
    },
    {
      "id": "E014",